CDB_ID,NOME,ENDERECO,IMAGEM,PETISCO,DESCRICAO
001,ARCOS BAR,"RUA DA BAHIA, 1144, CENTRO, BELO HORIZONTE, MG, BRASIL",https://s2-g1.glbimg.com/TBJlO2gBA-eoaA_0XK6kMNTIsZo=/0x0:3500x2333/984x0/smart/filters:strip_icc()/i.s3.glbimg.com/v1/AUTH_59edd422c0c84a879bd37670ae4f538a/internal_photos/bs/2025/M/J/KAr3B1SVAirdeLIPqERw/arcos-pratodadiversidade-bh-2025-rodneycosta-unibh-7624-1-.jpg,Panela da Diversidade,Acem cozido com ervas finas acompanhado com batata rústica
002,AZOUGUE FOGO E BAR,"RUA DO OURO, 835, SERRA, BELO HORIZONTE, MG, BRASIL",https://s2-g1.glbimg.com/4nvx0TTUnKRrUtN5CL_bOiTj0Fk=/0x0:3500x2333/984x0/smart/filters:strip_icc()/i.s3.glbimg.com/v1/AUTH_59edd422c0c84a879bd37670ae4f538a/internal_photos/bs/2025/u/s/9FRxz7Q0qRJcqZnW0Jxg/azougue-linguadevovovirinha-bh-2025-isaquerodrigues-unibh-7366.jpg,Lingua da vovó Virinha,Língua de boi assada sobre creme de batata e milho com vinagrete mineiro e redução do caldo da própria língua com cerveja.
003,BAIÚCA,"RUA PIAUI, 1884, SAVASSI, BELO HORIZONTE, MG, BRASIL",https://s2-g1.glbimg.com/jzIpvnVuWznTE1n1R0us6cuiIhU=/0x0:3500x2333/984x0/smart/filters:strip_icc()/i.s3.glbimg.com/v1/AUTH_59edd422c0c84a879bd37670ae4f538a/internal_photos/bs/2025/N/f/TKfXFPQHSX2YrDqyqRqQ/baiuca-caneladasuina-bh-2025-rodneycosta-unibh-7505.jpg,Canelada Suína,"Panturrilha suína, mandioca cozida com queijo e manteiga, cebola assada e crispe de couve."
004,BAR ESTABELECIMENTO,"RUA MONTE ALEGRE, 160, SERRA, BELO HORIZONTE, MG, BRASIL",https://s2-g1.glbimg.com/XMgVOHr-0_Y9lUNhH3Fr4JhfNng=/0x0:3500x2333/984x0/smart/filters:strip_icc()/i.s3.glbimg.com/v1/AUTH_59edd422c0c84a879bd37670ae4f538a/internal_photos/bs/2025/a/u/GFmmMsT2uYACp292e4oQ/barestabelecimento-tipracas-bh-2025-rodneycosta-unibh-8153.jpg,Tipracas,"Pelotas de rabada com angu de agrião e ""tipracas"" de arroz com feijão ( tipo bolachas )."
005,BAR MANIA MINEIRA,"RUA PARACATU, 1099, SANTO AGOSTINHO, BELO HORIZONTE, MG, BRASIL",https://cdb-static-files.s3.amazonaws.com/wp-content/uploads/2025/03/15050748/maniamineira_explosaodesabores_bh_2025_fernandaoliveira_unibh-8088-2048x1365.jpg,EXPLOSÃO DE SABOR,Bolinho de mandioca recheado com queijo
006,BECO RESTAURANTE,"RUA DOS TAMOIOS, 232, CENTRO, BELO HORIZONTE, MG, BRASIL",https://s2-g1.glbimg.com/YR-yuF2XwHEoH7FnW9euAthuyhs=/0x0:3500x2333/984x0/smart/filters:strip_icc()/i.s3.glbimg.com/v1/AUTH_59edd422c0c84a879bd37670ae4f538a/internal_photos/bs/2025/X/r/xMmYnyRDGtD7l0NJev1A/becorestaurante-ladicasa-bh-2025-fernandaoliveira-unibh-8137.jpg,Lá di Casa,"Carne bovina cozida na panela de pressão e reduzida no molho à base demi glace. Acompanha nosso creme de mandioca caseira, farofa crocante de panko e crispy de couve."
007,BOTEQUIM DE LOURDES,"RUA CURITIBA, 2039, LOURDES, BELO HORIZONTE, MG, BRASIL",https://s2-g1.glbimg.com/NstkedZjELZYc7HupHQceFxftz4=/0x0:3500x2333/1000x0/smart/filters:strip_icc()/i.s3.glbimg.com/v1/AUTH_59edd422c0c84a879bd37670ae4f538a/internal_photos/bs/2025/w/b/02wB31RD2c6DRlteJ8dg/butequimlourdes-rocamboledetorresmoquesoobutequimtem-bh-2025-rodneycosta-unibh-9228.jpg,ROCAMBOLE DE TORRESMO QUE SÓ NO BOTEQUIM TEM,"TORRESMO DE BARRIGA MARINADO NA CACHAÇA, SERVIDO COM PALITINHOS DE TAPIOCA E GELEIA DE ABACAXI COM PIMENTA E CANELA."
008,CAFÉ BAHIA,"RUA DOS TUPIS, 369, CENTRO, BELO HORIZONTE, MG, BRASIL",https://s2-g1.glbimg.com/XVcQ1oFtmwTKXIXhs9NqWKTj1F0=/0x0:3500x2333/984x0/smart/filters:strip_icc()/i.s3.glbimg.com/v1/AUTH_59edd422c0c84a879bd37670ae4f538a/internal_photos/bs/2025/G/T/GlwlU5SgSeEBC1SS0gSQ/cafebahia-trupiqueinobahia-bh-2025-amandacantanhede-unibh-9006.jpg,TRUPIQUEI NO BAHIA,"Defumados de porco e carne de sol no feijão vermelho,pelinha crocrante, polentinha mineira e mostarda refogada."
009,CAFÉ PALHARES,"RUA DOS TUPINAMBAS, 638, CENTRO, BELO HORIZONTE, MG, BRASIL",https://cdb-static-files.s3.amazonaws.com/wp-content/uploads/2025/03/15050219/cafepalhares_polpetadeberingelacomdoisqueijos_bh_2025_fernandaoliveira_unibh-8289-scaled.jpg,POLPETA DE BERINJELA COM DOIS QUEIJOS,"Polpetas de berinjela com queijo parmesão, mozarela, manjericão e salsinha. Servidas com pasta de grão-de-bico."
010,CASA DA MADRINHA,"AVENIDA BARBACENA, 212, BARRO PRETO, BELO HORIZONTE, MG, BRASIL",https://s2-g1.glbimg.com/yF9qPVIeHsIR0yJ8UgEGP9i4IbQ=/0x0:3500x2333/984x0/smart/filters:strip_icc()/i.s3.glbimg.com/v1/AUTH_59edd422c0c84a879bd37670ae4f538a/internal_photos/bs/2025/4/q/fpljkBRuGLUREDsX9Rrw/casadamadrinha-bemmineiro-bh-2025-amandacantanhede-unibh-8867.jpg,Bem Mineiro,Polenta crocante com ragu de frango com quiabo e o toque inconfundível do queijo minas.
011,DONA DORA,"RUA RIO DE JANEIRO, 1205, CENTRO, BELO HORIZONTE, MG, BRASIL",https://s2-g1.glbimg.com/_ajR7lZ1GL7w7D0U-4FIuoIFESo=/0x0:3500x2333/984x0/smart/filters:strip_icc()/i.s3.glbimg.com/v1/AUTH_59edd422c0c84a879bd37670ae4f538a/internal_photos/bs/2025/j/Y/FiOXk7QUSDlzaooYgYlA/donadora-boleco-bolodecuteco-bh-2025-rodneycosta-unibh-8708.jpg,Boleco (Bolo di Buteco),"Purê rústico de mandioca com ragú de alcatra, fonduta de queijo canastra e crispy de couve."
012,EMBER BBQ,"RUA SAO ROMAO, 460, SANTO ANTONIO, BELO HORIZONTE, MG, BRASIL",https://s2-g1.glbimg.com/gYST4CTUQziE20eZIrvkBan5FKw=/0x0:3500x2333/984x0/smart/filters:strip_icc()/i.s3.glbimg.com/v1/AUTH_59edd422c0c84a879bd37670ae4f538a/internal_photos/bs/2025/B/Q/CezNEsSJCTq6gvIjqFzg/embeer-cupimsertanejo-bh-2025-isaquerodrigues-unibh-7851.jpg,Cupim Sertanejo,Cupim defumado em lenha de macieira. Servido sobre angú de milho verde com queijo minas acompanhado de couve crispy e pimenta jalapeno.
013,MARINA'S BAR,"RUA JOSE BARONI, 13, PARAISO, BELO HORIZONTE, MG, BRASIL",https://cdb-static-files.s3.amazonaws.com/wp-content/uploads/2025/03/19154422/marinas_essetremvoa_bh_2025_isaquerodrigues_unibh-7376-scaled.jpg,Estrem voa!,"Asinha de frango frita, marinada na laranja e ervas ,coberta de queijo muçarela acompanhada com creme de alho poró e gengibre picante e fritas."
014,ORATÓRIO BAR,"AVENIDA BRASIL, 161, SANTA EFIGENIA, BELO HORIZONTE, MG, BRASIL",https://cdb-static-files.s3.amazonaws.com/wp-content/uploads/2025/03/19155430/oratoriobar_costeladeadao_bh_2025_amandacantanhede_unibh-8929-scaled.jpg,Costela de Adão,"Costelinha de porco assada; finalizada com molho barbecue e guarnecida em cama de farofa crocante , acompanhada de uma maçã caramelizada"
015,PÉ DE CANA,"RUA FLORIDA, 21, SION, BELO HORIZONTE, MG, BRASIL",https://cdb-static-files.s3.amazonaws.com/wp-content/uploads/2025/03/19155918/pedecana_eprata_bh_2025_isaquerodrigues_unibh-7883-scaled.jpg,É PRAAATA!!!É PRAAAATA!!,"Bolo suíno recheado de queijo, acompanhado de molho de tomate ,cobertura de muçarela e confetes de tomate , batatinha e cebola assadas,"
016,POIZÉ BAR E PETISQUEIRA,"RUA PIUM I, 686, CARMO, BELO HORIZONTE, MG, BRASIL",https://cdb-static-files.s3.amazonaws.com/wp-content/uploads/2025/03/15045021/poize_aparecidinhodoze_bh_2025_rodneycosta_unibh-7767-2048x1365.jpg,Aparecidinho do Zé,Versão desconstruída do escondidinho. Creme de moranga com carne do sertão e cebola. Acompanha molho de cebola roxa.
017,QUINTEIRO BAR E RESTAURANTE,"RUA SALINAS, 1008, FLORESTA, BELO HORIZONTE, MG, BRASIL",https://s2-g1.glbimg.com/6vuiJ7I5pjA1CNjRwF5F7D6q628=/0x0:3500x2333/984x0/smart/filters:strip_icc()/i.s3.glbimg.com/v1/AUTH_59edd422c0c84a879bd37670ae4f538a/internal_photos/bs/2025/F/y/nFk9sPTzOic89HmUFAWg/quinteirobar-voucomermeubolo-bh-2025-isaquerodrigues-unibh-8588.jpg,Vou comer seu bolo,"Massa de fubá com queijo, patinho desfiado com molho, tártara de tomate e cream cheese caseiro temperado."
018,RESTAURANTE JORGE AMERICANO,"AVENIDA AUGUSTO DE LIMA, 744, CENTRO, BELO HORIZONTE, MG, BRASIL",https://cdb-static-files.s3.amazonaws.com/wp-content/uploads/2025/03/15044742/jorgeamericano_rabadadojorge__bh_2025_isaquerodrigues_unih-7967-scaled.jpg,Rabada do Jorge Americano,"Rabada ensopada, servido com batata bolinha. Acompanhada de farofa de torresmo e vinagrete de agrião."
019,XAMBAR,"AVENIDA AUGUSTO DE LIMA, 233, CENTRO, BELO HORIZONTE, MG, BRASIL",https://cdb-static-files.s3.amazonaws.com/wp-content/uploads/2025/03/19172132/xambar_minerimorienta_bh_2025_isaquerodrigues_unibh-7522-scaled.jpg,Mineirin Oriental,"Miolo de acém assado na pressão, acompanhado de mandioca cozida na manteiga e farofa de banana."
020,AMARELIM DO PRADO,"AVENIDA FRANCISCO SA, 658, PRADO, BELO HORIZONTE, MG, BRASIL",https://s2-g1.glbimg.com/A1sXFeWp6YE12bpInykstKTPpHc=/0x0:3500x2333/984x0/smart/filters:strip_icc()/i.s3.glbimg.com/v1/AUTH_59edd422c0c84a879bd37670ae4f538a/internal_photos/bs/2025/a/S/Xdxhu9TjeTSCBS0id8FA/amarelimdoprado-tremderocas-bh-2025-isaquerodrigues-unibh-7527.jpg,Trem de roças,"Bochecha de porco na cama de angu mole, pesto de horta, mandioca e agrião. Acompanha pão e patê de fígado de galinha."
021,BAR E RESTAURANTE BOM SABOR,"RUA JAVA, 386, NOVA SUISSA, BELO HORIZONTE, MG, BRASIL",https://s2-g1.glbimg.com/21Zoe54QmFM6g5OmqY2t3ic8LL4=/0x0:3500x2333/984x0/smart/filters:strip_icc()/i.s3.glbimg.com/v1/AUTH_59edd422c0c84a879bd37670ae4f538a/internal_photos/bs/2024/H/O/rBY68xRPCVzPoSqA4ayQ/barrestbomsabor-frangoatolado-bh-2024-rodney-costa-7607-1-.jpg,Bora Comemorar,"FRALDINHA DE BOI RECHEADA COM CARNE MOIDA DE PORCO, BACOM E MUSSARELA ASSADO NA CHURRASQUEIRA. ACOMPANHADO DE FAROFA E VINAGRETE"
022,BAR BAMBÚ,"RUA DIVISA NOVA, 670, SALGADO FILHO, BELO HORIZONTE, MG, BRASIL",https://s2-g1.glbimg.com/OmMOS53MitRaLF443hT6x7V2HCc=/0x0:3500x2333/984x0/smart/filters:strip_icc()/i.s3.glbimg.com/v1/AUTH_59edd422c0c84a879bd37670ae4f538a/internal_photos/bs/2025/K/9/zVAopmSnm5MJgnxeDKJQ/barbambu-camaraoquedorme-bh-2025-fernandaoliveira-unibh-8355.jpg,Camarão que dorme?,Batata recheada com Strogonoff de camarão.
023,BAR DA SILVANIA,"RUA SOARES NOGUEIRA, 801, CAMARGOS, BELO HORIZONTE, MG, BRASIL",https://s2-g1.glbimg.com/6qRNLbj72tQ_Dow07f6FpFKzxbg=/0x0:2048x1365/984x0/smart/filters:strip_icc()/i.s3.glbimg.com/v1/AUTH_59edd422c0c84a879bd37670ae4f538a/internal_photos/bs/2025/j/B/o8XOatRyGg4sZt66UhSA/bardasilvania-otrembaumso-bh-2025-rodneycosta-unibh-8183-2048x1365.jpg,Õ trem bão sô,Maçã de peito com mandioquinha e torradas de pão francês.
024,BAR DO KIM,"PRAÇA APA, 110, JARDIM AMERICA, BELO HORIZONTE, MG, BRASIL",https://s2-g1.glbimg.com/-H47IF75563iFLwrEIYvYC4nrCo=/0x0:3500x2333/984x0/smart/filters:strip_icc()/i.s3.glbimg.com/v1/AUTH_59edd422c0c84a879bd37670ae4f538a/internal_photos/bs/2025/v/D/PG5HcbT3yJQYOBE5Wymg/bardokim-musculoamodadokim-bh-2025-isaquerodrigues-unibh-9323.jpg,Músculo à moda do Kim,Músculo ao molho madeira com champignon e palmito acompanhado de torradas
025,BAR DO PRIMO,"AVENIDA AMAZONAS, 4649, NOVA SUISSA, BELO HORIZONTE, MG, BRASIL",https://s2-g1.glbimg.com/yU_goSb8fBZKGE8flVLjbm_RebA=/0x0:3500x2333/984x0/smart/filters:strip_icc()/i.s3.glbimg.com/v1/AUTH_59edd422c0c84a879bd37670ae4f538a/internal_photos/bs/2025/k/B/bqNLBzRiesSYRqqwnIQQ/primo-costelinhadebuteco-bh-2025-isaquerodrigues-unibh-8526.jpg,Custelinha di Buteco,Costelinha com batata e queijo ao molho branco
026,BAR DO REGIS,"RUA GAVEA, 422, NOVA SUISSA, BELO HORIZONTE, MG, BRASIL",https://s2-g1.glbimg.com/8j-oBYw4AvxsZyj-QsTMpYHTrY4=/0x0:3500x2333/984x0/smart/filters:strip_icc()/i.s3.glbimg.com/v1/AUTH_59edd422c0c84a879bd37670ae4f538a/internal_photos/bs/2025/H/l/mdfy8UQryUFiEYJAJDPw/bardoregis-trilhademinas-bh-2025-amandacantanhede-unibh-8270.jpg,Trilhas de Minas,"Almôndegas ao molho de tomates, servida com polenta"
027,BAR DOS MENINOS,"RUA LINDOLFO DEODORO, 503, SALGADO FILHO, BELO HORIZONTE, MG, BRASIL",https://s2-g1.glbimg.com/UKIJMtUtnuPK4fj2w0SuXcIjFvk=/0x0:3500x2333/984x0/smart/filters:strip_icc()/i.s3.glbimg.com/v1/AUTH_59edd422c0c84a879bd37670ae4f538a/internal_photos/bs/2025/A/3/UMZKAPSrKx45QAHarWGQ/bardosmeninos-bodasdeprata-bh-2025-rodneycosta-unibh-8218.jpg,Bodas de prata,"Costelinha suína, marinada em vinho tinto servida com mostarda em folhas, acompanhada de creme de batata."
028,BAR JUNTO JUNTINHO,"RUA CURA D'ARS, 542, PRADO, BELO HORIZONTE, MG, BRASIL",https://s2-g1.glbimg.com/Woon-PL_OEZSTAa74c5VFkQykeY=/0x0:3500x2333/984x0/smart/filters:strip_icc()/i.s3.glbimg.com/v1/AUTH_59edd422c0c84a879bd37670ae4f538a/internal_photos/bs/2025/E/S/SpB1LBRz2AJN9qaukMEA/barjuntojuntinho-poliamorculinario-bh-2025-rodneycosta-unibh-1725-1-.jpg,POLIAMOR CULINÁRIO,"Costelinha de porco combinada com um purê de mandioca feito com manteiga de garrafa e queijo parmesão, acompanhado de couve couve crispe e geleia de abacaxi apimentada."
029,BARZIN DOS AMIGOS,"RUA LINDOLFO DE AZEVEDO, 1263, JARDIM AMERICA, BELO HORIZONTE, MG, BRASIL",https://s2-g1.glbimg.com/rHsSCU85eg8-jxL3Nl_CO8sjoDY=/0x0:3500x2333/984x0/smart/filters:strip_icc()/i.s3.glbimg.com/v1/AUTH_59edd422c0c84a879bd37670ae4f538a/internal_photos/bs/2025/0/O/xOLYXWSRaE0bYdusAuQg/bardosamigos-porpetadebuteco-bh-2025-isaquerodrigues-unibh-7775.jpg,Porpeta de Buteco,Almôndegas ao sugo com batata recheada.
030,BOOGIE OOGIE,"RUA SANTOS, 264, JARDIM AMERICA, BELO HORIZONTE, MG, BRASIL",https://s2-g1.glbimg.com/Lgp1559xLz-uyEV72hpZdFuey6w=/0x0:3500x2333/984x0/smart/filters:strip_icc()/i.s3.glbimg.com/v1/AUTH_59edd422c0c84a879bd37670ae4f538a/internal_photos/bs/2025/s/0/8ANFdfRIi7oVHXQG2BFw/booguieoogie-brancodeneveeseteanoes-bh-2025-isaquerodrigues-unibh-9371.jpg,Branca de Neve e os Sete Anões,"ESPETINHOS VARIADOS, FAROFA DE CEBOLA DA CASA ACOMPANHADO DE MOLHO CAMPANHA DE MAÇÃ DA BRUXA LEVEMENTE APIMENTADO."
031,BOTEQUIM BURITIS,"RUA VITORIO MAGNAVACCA, 39, BURITIS, BELO HORIZONTE, MG, BRASIL",https://s2-g1.glbimg.com/I4IKqkM4tVP1NgouGsr5fD0CB08=/0x0:3500x2333/984x0/smart/filters:strip_icc()/i.s3.glbimg.com/v1/AUTH_59edd422c0c84a879bd37670ae4f538a/internal_photos/bs/2025/F/s/V4KPPTSz2KNB3tBiXPAw/botequimburitis-butequeiro-bh-2025-isaquerodrigues-unibh-7665.jpg,Butequeiro 25,Lombinho suíno na lata acompanhado de mandioquinha frita ao molho cremoso raiz
032,CANELA AMARELA,"PRAÇA LEONARDO GUTIERREZ, 195, GUTIERREZ, BELO HORIZONTE, MG, BRASIL",https://s2-g1.glbimg.com/-qsWY4DfS3EDoi1og3D1TJ5sDyU=/0x0:3500x2333/984x0/smart/filters:strip_icc()/i.s3.glbimg.com/v1/AUTH_59edd422c0c84a879bd37670ae4f538a/internal_photos/bs/2025/B/6/njOWouQ6WxMvM9UjvMdw/canelaamarela-bolanarede-bh-2025-isaquerodrigues-unibh-9287.jpg,Bola Na Rede,Almôndegas bovinas sobre a cama de creme de queijos acompanhada de torradas de pão de alho e finalizada com tomatinho e manjericão. Acompanha molho da casa.
033,CERVEJARIA PAJÉ,"RUA CAPIM BRANCO, 419, VISTA ALEGRE, BELO HORIZONTE, MG, BRASIL",https://s2-g1.glbimg.com/vqLhgeL6sDpgWVzAPszLujmwUDQ=/0x0:3500x2333/984x0/smart/filters:strip_icc()/i.s3.glbimg.com/v1/AUTH_59edd422c0c84a879bd37670ae4f538a/internal_photos/bs/2025/4/B/fQTuA9Q1CvBTIBWVxQwg/cervejariapaje-xukurukariri-bh-2025-mylenaizis-unibh-8027.jpg,XUKURU KARIRI,"Amassado de mandioca amarela, temperada e recheada com bacon e queijo, acompanhado de calda de abacaxi ?smooth Cayenne? e molho ""Buffalo"" picante."
034,CHOPP DA ESQUINA,"RUA GARRET, 263, NOVA GRANADA, BELO HORIZONTE, MG, BRASIL",https://cdb-static-files.s3.amazonaws.com/wp-content/uploads/2025/03/19152143/choppdaesquina_roledochopp_bh_2025_isaquerodrigues_unibh-8826-scaled.jpg,Rolê do Chopp,"Bife a rolê, acompanha farofa de torresmo"
035,ESPETTINHO.COM,"RUA ELI SEABRA FILHO, 510, BURITIS, BELO HORIZONTE, MG, BRASIL",https://cdb-static-files.s3.amazonaws.com/wp-content/uploads/2025/03/19153114/espettinhocom_mineirimgratinado_bh_2025_rodneycosta_unibh-9129-1536x1024.jpg,MINEIRINHO GRATINADO 2.5,"Almôndegas suínas gratinadas com molho de tomate caseiro e mussarela. Acompanha 1 Espetinho de ""Sacanagem"" e um licor de doce de leite de entrada."
036,GERALDIN DA CIDA,"RUA CONTRIA, 1459, GRAJAU, BELO HORIZONTE, MG, BRASIL",https://s2-g1.glbimg.com/mjTXAnmEmOh-_e3ONTeaMLR0sOU=/0x0:3500x2333/984x0/smart/filters:strip_icc()/i.s3.glbimg.com/v1/AUTH_59edd422c0c84a879bd37670ae4f538a/internal_photos/bs/2025/Q/l/jpUiATQoi0YzBxERXRXw/geraldimdacida-soumineirouai-bh-2025-rodneycosta-unibh-8364.jpg,"Sô mineiro, uai!",Alcatra com farofa de jilo com bacon. Acompanha uma sobremesa de doce de leite com castanha e bacon.
037,PÉ DE GOIABA,"AVENIDA AMAZONAS, 4676, NOVA SUISSA, BELO HORIZONTE, MG, BRASIL",https://cdb-static-files.s3.amazonaws.com/wp-content/uploads/2025/03/15044957/pedegoiaba_bodasdeprata_bh_2025_isaquerodrigues_unibh-8633-scaled.jpg,Bordas de Prata - 25 ANOS JUNTOS,"Lombo com queijo ao molho de abacaxi picante, farofa de bacon, torresminho a pururuca e couve"
038,PRADO BEER,"AVENIDA FRANCISCO SA, 590, PRADO, BELO HORIZONTE, MG, BRASIL",https://cdb-static-files.s3.amazonaws.com/wp-content/uploads/2025/03/19160250/pradobeer_amontadinho_bh_2025_isaquerodrigues_unibh-8981-scaled.jpg,Amontadinho,"Angu com carne de panela, chips de jiló e molho a base de milho e cachaça"
039,QUIOXQUE BOTEQUIM CARIOCA,"RUA HENRIQUE BADARO PORTUGAL, 157, BURITIS, BELO HORIZONTE, MG, BRASIL",https://cdb-static-files.s3.amazonaws.com/wp-content/uploads/2025/03/19170333/quioxque_estamosdeparabens_bh_2025_isaquerodrigues_unibh-7820-scaled.jpg,ESTAMOS DE PARABÉNS,"BOLO DE MANDIOCA COM CARNE SECA COM COBERTURA DE CEBOLA CARAMELIZADA E FONDUTA DE QUEIJO, SERVIDO COM PELINHA DE COSTELINHA COM TOQUE DE LIMAO"
040,US MOTOCA,"RUA BLENDA, 91, CAMARGOS, BELO HORIZONTE, MG, BRASIL",https://cdb-static-files.s3.amazonaws.com/wp-content/uploads/2025/03/15044259/usmotoca_bodasdeprata_bh_2025_mylenaizis_unibh-9157-scaled.jpg,Bodas de Prata,"Polpetas de carne recheadas com queijo servido sobre aligot de batata e molho de tomates rustico, gratinado e guarnecido de crispy de jilo e pickles de cebola rocha."
041,BAR DO NELSON,"RUA VICENTE RISOLA, 1000, SANTA INES, BELO HORIZONTE, MG, BRASIL",https://s2-g1.glbimg.com/xOoZoKRrKnEHiupBdo0r3VB0WL8=/0x0:3500x2333/984x0/smart/filters:strip_icc()/i.s3.glbimg.com/v1/AUTH_59edd422c0c84a879bd37670ae4f538a/internal_photos/bs/2025/w/9/DD84CfRTiAfsTlSXjmgA/bardonelson-bolinhodeprata-bh-2025-amandacantanhede-unibh-9036.jpg,Boudas de Prata,Bolinho de feijoada
042,BAR DU DU,"RUA VIOLETA, 369, ESPLANADA, BELO HORIZONTE, MG, BRASIL",https://comidadibuteco.com.br/wp-content/uploads/2022/03/Bar-du-Du_Moela-do-Papai_Pocos-de-Caldas_2023_Dreison-Medeiros-scaled.jpg,Porco sem vergonha,Picadinho de carne de porco ao molho acompanhado de um creme de batata
043,BAR TEMÁTICO STA TERESA,"RUA PIRITE, 187, SANTA TEREZA, BELO HORIZONTE, MG, BRASIL",https://cdb-static-files.s3.amazonaws.com/wp-content/uploads/2025/03/15050630/tematico_cdb_25desucessoarrumado_bh_2025_rodneycosta_unibh-9084-scaled.jpg,#CDB - 25 anos de sucesso - Arrumado,"Carne de sol, feijão de corda, farofa e vinagrete e manteiga de garrafa ."
044,COSMOS,"RUA VICENTE RISOLA, 1305, SANTA INES, BELO HORIZONTE, MG, BRASIL",https://s2-g1.glbimg.com/T7ICQMnz0pBmz14LiRzhJ1ars6I=/0x0:3500x2333/984x0/smart/filters:strip_icc()/i.s3.glbimg.com/v1/AUTH_59edd422c0c84a879bd37670ae4f538a/internal_photos/bs/2025/P/G/VvtaR9SfOWa39kXNBVLw/cosmos-meteoroexplosaodesabores-bh-2025-rodneycosta-unibh-7483.jpg,Meteoro - Explosão de sabores,"Tiras de picanha, alcatra e maminha ao molho de cerveja preta, com batata tipo chips e creme de alho."
045,IRACEMA BAR,"RUA ALMANDINA, 56, SANTA TEREZA, BELO HORIZONTE, MG, BRASIL",https://cdb-static-files.s3.amazonaws.com/wp-content/uploads/2025/03/19153541/iracema_harumakidecarnedepanela_bh_2025_fernandaoliveira_unibh-8240-scaled.jpg,Harumaki de Carne de Panela servido com molho picante de cebola caramelizada,"Harumaki, também conhecido como rolinho primavera, recheado com uma carne de panela cozida bem devagarinho e cheia de especiarias. Servido com um molho agridoce e picante. Uma explosão de texturas e sabores."
046,KOQUEIROS BAR,"AVENIDA SILVIANO BRANDAO, 1293, SAGRADA FAMILIA, BELO HORIZONTE, MG, BRASIL",https://s2-g1.glbimg.com/UGo8at6j82f5U7oC-O7l5VV2C68=/0x0:3500x2333/984x0/smart/filters:strip_icc()/i.s3.glbimg.com/v1/AUTH_59edd422c0c84a879bd37670ae4f538a/internal_photos/bs/2025/C/1/drW6JKTWuGQR4u2DsvrA/koqueiros-duvideimasamei-bh-2025-isaquerodrigues-unibh-7679.jpg,"Duvidei, mas amei!","Berinjela empanada e frita servida ao molho à bolonhesa em uma cama de requeijão cremoso, coberta de muçarela. Acompanha pasteizinhos de vento da casa."
047,LOCOMOTIVAS BAR,"RUA CARMESIA, 568, SANTA INES, BELO HORIZONTE, MG, BRASIL",https://s2-g1.glbimg.com/TQqAlYVssb3uEzvSClqZKmXv4Ak=/0x0:3500x2333/984x0/smart/filters:strip_icc()/i.s3.glbimg.com/v1/AUTH_59edd422c0c84a879bd37670ae4f538a/internal_photos/bs/2025/p/O/7movpNRjC5nrug5R9kuQ/locomotivasbar-cumpimembreagadoetrouxa-bh-2025-amandacantanhede-unibh-8315.jpg,CUPIM: Embriagado e trouxa,"Trouxinha recheada com cupim marinado na cachaça e queijo canastra, acompanha maionese de alho"
048,QUITANDAS DA TIA NICE BAR,"RUA ALABASTRO, 146, SAGRADA FAMILIA, BELO HORIZONTE, MG, BRASIL",https://cdb-static-files.s3.amazonaws.com/wp-content/uploads/2025/03/15044911/quitandatianice_queceque_bh_2025_rodneycosta_unibh-7389-2048x1365.jpg,QUÊ SÉ QUÉ!,Disco de Carne Recheada com Provolone
049,REGIS BAR,"RUA VINTE E OITO DE SETEMBRO, 872, ESPLANADA, BELO HORIZONTE, MG, BRASIL",https://cdb-static-files.s3.amazonaws.com/wp-content/uploads/2025/03/15044821/regisbar_trioparadadura_bh_2025_isaquerodrigues_unibh-8785-scaled.jpg,Trio parada dura,Costelinha ao molho de abacaxi com mandioca e cebola
050,SANTA BOEMIA,"RUA MARMORE, 534, SANTA TEREZA, BELO HORIZONTE, MG, BRASIL",https://s2-g1.glbimg.com/joRyFdM_F7vGdyoahrnx6cquiJ4=/0x0:3500x2333/984x0/smart/filters:strip_icc()/i.s3.glbimg.com/v1/AUTH_59edd422c0c84a879bd37670ae4f538a/internal_photos/bs/2025/u/V/1xcDOZQ5SYHtErKSW0YA/santaboemia-sextoubb-bh-2025-rodneycosta-unibh-7592.jpg,Sextou BB!,"Bolinhos de feijoada, recheados com calabresa e couve, acompanhados de torresminho pururuca, vinagrete da casa, laranja e uma dose de cachaça"
051,SILVIO'S BAR,"RUA BEGONIA, 199, ESPLANADA, BELO HORIZONTE, MG, BRASIL",https://s2-g1.glbimg.com/zaxyrYGi6qblQiL53MdlyoxJS9I=/0x0:3500x2333/984x0/smart/filters:strip_icc()/i.s3.glbimg.com/v1/AUTH_59edd422c0c84a879bd37670ae4f538a/internal_photos/bs/2025/Y/f/IzbrtJQt219jCz4qyhLA/silviosbar-frangonia-bh-2025-rodneycosta-unibh-7982.jpg,Frangônia,"Coxinha da asa de frango empanado, acompanha batata rústica e molho parmesão e ervas."
052,SINHÁ EROZITHA BISTRÔTECO,"RUA SANTO AMARO, 257, SAGRADA FAMILIA, BELO HORIZONTE, MG, BRASIL",https://s2-g1.glbimg.com/CyJ94456KRwbM_x0X6anDUp20sc=/0x0:3500x2333/984x0/smart/filters:strip_icc()/i.s3.glbimg.com/v1/AUTH_59edd422c0c84a879bd37670ae4f538a/internal_photos/bs/2025/0/A/yMwOHGRkOzxeo8WfQlJw/sinhaerozitha-elasquera-bh-2025-isaquerodrigues-unibh-8251.jpg,"Êêêê, lasqueira!!!",PANTURRILHA SUÍNA NO SEU MOLHO COM LEGUMES GRELHADOS
053,BAR DO BARTOLOMEU,"RUA ARTHUR LUCCHESI, 356, SANTA HELENA, BELO HORIZONTE, MG, BRASIL",https://s2-g1.glbimg.com/UY3duScf7xPGl5ujAQRP6cOf_eE=/0x0:3500x2333/1000x0/smart/filters:strip_icc()/i.s3.glbimg.com/v1/AUTH_59edd422c0c84a879bd37670ae4f538a/internal_photos/bs/2025/J/P/asYaFLRcA0sFNkfLZSqA/bardobartolomeu-bembolado-bh-2025-fernandaoliveira-unibh-8039.jpg,"Bem Bolado, Uai!!",Bolinho de rabada com catupiry e alho poró. Acompanhado com molho da casa e molho geleia de pimenta.
054,BAR E RESTAURANTE DO JOÃOZINHO,"RUA PINHEIRO CHAGAS, 295, BARREIRO, BELO HORIZONTE, MG, BRASIL",https://cdb-static-files.s3.amazonaws.com/wp-content/uploads/2025/03/24070652/bardojoaozinho_triomineiro_bh_2025_rodneycosta_unibh-7419-scaled.jpg,Trio Mineiro,"Quarteto: carne de lata bovina frita, torresmo pururuca, queijo temperado a moda da casa, molho de alho poró."
055,ESPETINHO DO BOI,"RUA SAO PAULO DA CRUZ, 357, BARREIRO, BELO HORIZONTE, MG, BRASIL",https://cdb-static-files.s3.amazonaws.com/wp-content/uploads/2025/03/19152726/espetinhodoboi_brigadeirodoboi_bh_2025_rodneycosta_unibh-8501-scaled.jpg,Brigadeiro do Boi,Almondega selada no forno com cobertura de queijo e salpicada com torresmo ao molho especial.
056,GOLDEN GRILL,"RUA AMILCAR CABRAL, 515, MILIONARIOS, BELO HORIZONTE, MG, BRASIL",https://cdb-static-files.s3.amazonaws.com/wp-content/uploads/2025/03/15045801/goldengrill_costelaodosdeuses_bh_2025_rodneycosta_unibh-8167-scaled.jpg,Costelão dos Deuses,"Costelão de boi marinado em ervas finas acompanhado de purê de mandioca aligot , Farofa crocante e molho agridoce especial."
057,JÁ TO INNO,"RUA BENJAMIM DIAS, 379, BARREIRO, BELO HORIZONTE, MG, BRASIL",https://cdb-static-files.s3.amazonaws.com/wp-content/uploads/2025/03/15045650/jatoinno_moderacao_bh_2025_fernandaoliveira_unibh-8097-scaled.jpg,Moderação,"Kafta de lata, acompanhada de caponata de tomate com bacon e linguiça regados com angu a moda da casa gratinado com queijo."
058,LEO DA QUADRA,"RUA OLIVEIRA LISBOA, 107, BARREIRO, BELO HORIZONTE, MG, BRASIL",https://s2-g1.glbimg.com/2wxjwT3B8DMyFkqO9V9nGC3MqU8=/0x0:3500x2333/984x0/smart/filters:strip_icc()/i.s3.glbimg.com/v1/AUTH_59edd422c0c84a879bd37670ae4f538a/internal_photos/bs/2025/B/L/e4w98WTQudCUzTp6AvyQ/leodaquadra-lembeosbeicos-bh-2025-rodneycosta-unibh-7632.jpg,Lembe os beiço,Bisteca bovina acompanhando de pirão e torradas
059,ALEXANDRE'S BAR,"RUA DAVID ALVES DO VALE, 68, SANTA ROSA, BELO HORIZONTE, MG, BRASIL",https://s2-g1.glbimg.com/w6xgTZb45ExVKcLoRAFIaPl2iwA=/0x0:3500x2333/984x0/smart/filters:strip_icc()/i.s3.glbimg.com/v1/AUTH_59edd422c0c84a879bd37670ae4f538a/internal_photos/bs/2025/T/o/nXdbyMTvuav3ZpGEAotA/alexandresbar-fabulosodiscao-bh-2025-isaquerodrigues-unibh-8111.jpg,O fabuloso discão,Polpetone com recheio de muçarela acompanhada com caponata de berinjela e abobrinha.
